{
 "evidence_environment": "SIMULATION",
 "experiment_manifest": {
  "command": "tools/simulate_anytime_validity.py",
  "compiler": "cc (Ubuntu 13.3.0-6ubuntu2~24.04.1) 13.3.0",
  "csia_config_hash": "25c2a143b244f1c2",
  "dataset_aggregate_hash": null,
  "dataset_id": null,
  "dataset_partition": null,
  "dependency_lock_sha256": "b81a0101de46835a",
  "evidence_environment": "SIMULATION",
  "exclusions": [],
  "experiment_id": "anytime_validity_t1-20260803T062529Z",
  "experiment_type": "anytime_validity_t1",
  "failsafe_config_hash": "2d636a3f7e9c2438",
  "failures": [],
  "git_commit": "116c2cf99a1b28a9b9a20068a536a7fe3e3f75ee",
  "git_dirty": true,
  "git_remote": "http://local_proxy@127.0.0.1:41729/git/SWORT-Aerospace/csia-trust-layer",
  "input_logs": [],
  "manifest_schema_version": "1.0.0",
  "metric_definitions_version": "1.1.0",
  "native_flags": "-std=c11 -Wall -Wextra -Wpedantic -Werror -O2",
  "os_platform": "Linux-6.18.5-x86_64-with-glibc2.39",
  "output_paths": [
   "experiments/results/anytime_validity_v1.json"
  ],
  "processor_arch": "x86_64",
  "python_version": "3.11.15",
  "random_seed": null,
  "result_schema_version": "1.0.0",
  "runtime_duration_s": null,
  "threshold_config_hash": "2d636a3f7e9c2438",
  "timestamp_utc": "2026-08-03T06:25:29Z",
  "trust_graph_config_hash": "534f4a31eed1a792",
  "warnings": []
 },
 "payload": {
  "T": 3000,
  "alpha": 0.05,
  "cells": {
   "eval/blockwise_L50/ar1_0.5": {
    "bound": 0.05,
    "crossing_rate": 0.0248,
    "n_paths": 4000,
    "se": 0.0025,
    "violates": false
   },
   "eval/blockwise_L50/ar1_0.94": {
    "bound": 0.05,
    "crossing_rate": 0.0498,
    "n_paths": 4000,
    "se": 0.0034,
    "violates": false
   },
   "eval/blockwise_L50/ar1_0.99": {
    "bound": 0.05,
    "crossing_rate": 0.208,
    "n_paths": 4000,
    "se": 0.0064,
    "violates": true
   },
   "eval/blockwise_L50/regime_IGNORED_context": {
    "bound": 0.05,
    "crossing_rate": 0.785,
    "n_paths": 4000,
    "se": 0.0065,
    "violates": true
   },
   "eval/blockwise_L50/regime_oracle_context": {
    "bound": 0.05,
    "crossing_rate": 0.0475,
    "n_paths": 4000,
    "se": 0.0034,
    "violates": false
   },
   "eval/lr_MISSPECIFIED_iid_assumed/ar1_0.94": {
    "bound": 0.05,
    "crossing_rate": 0.4467,
    "n_paths": 4000,
    "se": 0.0079,
    "violates": true
   },
   "eval/lr_correct_null/ar1_0.94": {
    "bound": 0.05,
    "crossing_rate": 0.0088,
    "n_paths": 4000,
    "se": 0.0015,
    "violates": false
   },
   "eval/naive/ar1_0.94_KNOWN_INVALID": {
    "bound": 0.05,
    "crossing_rate": 0.442,
    "n_paths": 4000,
    "se": 0.0079,
    "violates": true
   },
   "eval/naive/calibration_reuse": {
    "bound": 0.05,
    "crossing_rate": 0.0107,
    "n_paths": 4000,
    "se": 0.0016,
    "violates": false
   },
   "eval/naive/iid": {
    "bound": 0.05,
    "crossing_rate": 0.0248,
    "n_paths": 4000,
    "se": 0.0025,
    "violates": false
   },
   "eval/naive/t3_iid": {
    "bound": 0.05,
    "crossing_rate": 0.0257,
    "n_paths": 4000,
    "se": 0.0025,
    "violates": false
   },
   "select/ar1_0.5/L1": {
    "bound": 0.05,
    "crossing_rate": 0.152,
    "n_paths": 2000,
    "se": 0.008,
    "violates": true
   },
   "select/ar1_0.5/L100": {
    "bound": 0.05,
    "crossing_rate": 0.027,
    "n_paths": 2000,
    "se": 0.0036,
    "violates": false
   },
   "select/ar1_0.5/L25": {
    "bound": 0.05,
    "crossing_rate": 0.0325,
    "n_paths": 2000,
    "se": 0.004,
    "violates": false
   },
   "select/ar1_0.5/L5": {
    "bound": 0.05,
    "crossing_rate": 0.0525,
    "n_paths": 2000,
    "se": 0.005,
    "violates": false
   },
   "select/ar1_0.5/L50": {
    "bound": 0.05,
    "crossing_rate": 0.025,
    "n_paths": 2000,
    "se": 0.0035,
    "violates": false
   },
   "select/ar1_0.94/L1": {
    "bound": 0.05,
    "crossing_rate": 0.4595,
    "n_paths": 2000,
    "se": 0.0111,
    "violates": true
   },
   "select/ar1_0.94/L100": {
    "bound": 0.05,
    "crossing_rate": 0.036,
    "n_paths": 2000,
    "se": 0.0042,
    "violates": false
   },
   "select/ar1_0.94/L25": {
    "bound": 0.05,
    "crossing_rate": 0.107,
    "n_paths": 2000,
    "se": 0.0069,
    "violates": true
   },
   "select/ar1_0.94/L5": {
    "bound": 0.05,
    "crossing_rate": 0.2945,
    "n_paths": 2000,
    "se": 0.0102,
    "violates": true
   },
   "select/ar1_0.94/L50": {
    "bound": 0.05,
    "crossing_rate": 0.0565,
    "n_paths": 2000,
    "se": 0.0052,
    "violates": false
   },
   "select/ar1_0.99/L1": {
    "bound": 0.05,
    "crossing_rate": 0.5385,
    "n_paths": 2000,
    "se": 0.0111,
    "violates": true
   },
   "select/ar1_0.99/L100": {
    "bound": 0.05,
    "crossing_rate": 0.113,
    "n_paths": 2000,
    "se": 0.0071,
    "violates": true
   },
   "select/ar1_0.99/L200": {
    "bound": 0.05,
    "crossing_rate": 0.054,
    "n_paths": 2000,
    "se": 0.0051,
    "violates": false
   },
   "select/ar1_0.99/L25": {
    "bound": 0.05,
    "crossing_rate": 0.301,
    "n_paths": 2000,
    "se": 0.0103,
    "violates": true
   },
   "select/ar1_0.99/L400": {
    "bound": 0.05,
    "crossing_rate": 0.014,
    "n_paths": 2000,
    "se": 0.0026,
    "violates": false
   },
   "select/ar1_0.99/L5": {
    "bound": 0.05,
    "crossing_rate": 0.456,
    "n_paths": 2000,
    "se": 0.0111,
    "violates": true
   },
   "select/ar1_0.99/L50": {
    "bound": 0.05,
    "crossing_rate": 0.218,
    "n_paths": 2000,
    "se": 0.0092,
    "violates": true
   }
  },
  "kappa": 0.5,
  "power": {
   "blockwise_L50/ar1_0.94/shift0.5": {
    "detection_rate": 0.689,
    "median_latency_ticks": 1050
   },
   "blockwise_L50/ar1_0.94/shift1.0": {
    "detection_rate": 1.0,
    "median_latency_ticks": 400
   }
  },
  "protocol": {
   "evaluation_seed_base": 1000,
   "rule": "block length selected on selection seeds ONLY; final numbers from evaluation seeds",
   "selection_seed_base": 0
  },
  "runtime_s": 19.4,
  "selected_block_len": 50,
  "threshold": 20.0,
  "validity_domain": {
   "boundary_counterexample": "rho = 0.99 violates at L <= 100 (0.113 at L=100) and is restored at L = 200 (0.054) and L = 400 (0.014): L must scale with the mixing time",
   "declared": "AR(1)-like dependence with rho <= 0.94 (approx. 15-tick decorrelation, CSIA's smoothed regime)"
  }
 },
 "result_schema_version": "1.0.0",
 "result_type": "MONTE_CARLO"
}